[
  {
    "id": "ef7ceb37-de43-4a82-9f45-19bb5d091b61",
    "field_id": "00000000-0000-0000-0000-000000000005",
    "name": "ALT A",
    "value": "A",
    "synonyms": [
      {
        "langu_id": "en",
        "value": "Synonym of ALT A"
      }
    ]
  },
  {
    "id": "44c6115a-84a1-48a5-9f9c-96d2c1dbc312",
    "field_id": "00000000-0000-0000-0000-000000000005",
    "name": "ALT C",
    "value": "C",
    "synonyms": [
      {
        "langu_id": "en",
        "value": "Synonym of ALT C"
      }
    ]
  }
]